Brian Ross,Ivo D¨¹ntschProvide student with the opportunity to apply what they've learned in their academic studies through career-oriented work experiences at employer sites.,Restriction: open to BCB and COSC Co-op students.
"Note: students will be required to prepare learning objectives, participate in a site visit, write a work term report and receive a successful work term performance evaluation. This course may be offered in multiple modes of delivery. The method of delivery will be listed on the academic timetable, in the applicable term.",COSC 2C05
Co-op Reflective Learning and Integration V,Provide student with the opportunity to apply what they've learned in their academic studies through career-oriented work experiences at employer sites.
Restriction: open to BCB and COSC Co-op students.,"Note: students will be required to prepare learning objectives, participate in a site visit, write a work term report and receive a successful work term performance evaluation. This course may be offered in multiple modes of delivery. The method of delivery will be listed on the academic timetable, in the applicable term."
COSC 2N90,Internship
Work placement of 8-16 months duration with an approved employer.,Restriction: open to students accepted into the Internship option.
